<?xml version="1.0" encoding="UTF-8"?>
<!DOCTYPE car SYSTEM "..\Cars.dtd">
<car>
    <manufacturer_bg>Порше</manufacturer_bg>
    <manufacturer_en>Porsche</manufacturer_en>
    <model generation = "991 II">911</model>        
    <year_of_production>2015</year_of_production>
    <body_type>Купе</body_type>
    <powertrain>
        <engine fuel = "бензин" number_of_cylinders = "6" position="отзад">
            <power units = "конски сили">580</power>
            <torque units = "нютон метри" at="2250-4000об/мин">750</torque>
            <capacity units = "см3">3800</capacity>
            <consumption units = "литри/100 км." type = "комбиниран">9.1</consumption>
            <emissions units = "грама CO2/км." class = "ЕВРО6">212</emissions>
        </engine>
        <transmission number_of_gears = "7">автоматична</transmission>
    </powertrain>
    <acceleration units = "секунди" type = "0-100км/ч">2.9</acceleration>
    <maximum_speed units = "км/ч">330</maximum_speed>
    <fuel_tank_volume units = "литри">68</fuel_tank_volume>
    <chassi>
        <front_suspension>независимо тип McPherson</front_suspension>
        <rear_suspension>многолостово независимо окачване</rear_suspension>
        <front_brakes>дискови вентилирани</front_brakes>
        <rear_brakes>дискови вентилирани</rear_brakes>
    </chassi>        
    <number_of_doors>2</number_of_doors>
    <number_of_seats>4</number_of_seats>
    <kerb_weight units = "кг.">1600</kerb_weight>
    <length units = "мм">4507</length>
    <width units = "мм">1880</width>
    <height units = "мм">1297</height>
    <features>
        <feature>Антиблокираща система</feature>
        <feature>Тракшън контрол</feature>
        <feature>4x4</feature>
        <feature>Климатроник</feature>
        <feature>Круиз контрол</feature>
        <feature>Система - асистент при паркиране</feature>
        <feature>Сензор за дъжд</feature>
        <feature>Вградена система за навигация</feature>
        <feature>Отопление на седалките</feature>
        <feature>Спортно окачване</feature>
        <feature>Спортни седалки</feature>
    </features>        
</car>

