<?xml version="1.0" encoding="UTF-8"?>
<!DOCTYPE car SYSTEM "..\Cars.dtd">
<car>
    <manufacturer_bg>Субару</manufacturer_bg>
    <manufacturer_en>Subaru</manufacturer_en>
    <model generation = "3">Импреза</model>        
    <year_of_production>2008</year_of_production>
    <body_type>Хечбек</body_type>
    <powertrain>
        <engine fuel = "бензин" number_of_cylinders = "4" position="отпред">
            <power units = "конски сили">330</power>
            <torque units = "нютон метри" at="3400об/мин">470</torque>
            <capacity units = "см3">2457</capacity>
            <consumption units = "литри/100 км." type = "комбиниран">10.3</consumption>
            <emissions units = "грама CO2/км." class = "ЕВРО4">243</emissions>
        </engine>
        <transmission number_of_gears = "6">ръчна</transmission>
    </powertrain>
    <acceleration units = "секунди" type = "0-100км/ч">4.8</acceleration>
    <maximum_speed units = "км/ч">250</maximum_speed>
    <fuel_tank_volume units = "литри">60</fuel_tank_volume>
    <chassi>
        <front_suspension>няколко носача и щанги</front_suspension>
        <rear_suspension>няколко носача и щанги</rear_suspension>
        <front_brakes>дискови вентилирани</front_brakes>
        <rear_brakes>дискови</rear_brakes>
    </chassi>        
    <number_of_doors>4</number_of_doors>
    <number_of_seats>5</number_of_seats>
    <kerb_weight units = "кг.">1535</kerb_weight>
    <length units = "мм">4415</length>
    <width units = "мм">1740</width>
    <height units = "мм">1475</height>
    <features>
        <feature>Антиблокираща система</feature>
        <feature>Тракшън контрол</feature>
        <feature>Темпомат</feature>
        <feature>Климатроник</feature>
        <feature>Навигация</feature>       
        <feature>Спортни седалки</feature>
        <feature>Фарове за мъгла</feature>               
    </features>        
</car>

