<?xml version="1.0" encoding="UTF-8"?>
<!DOCTYPE car SYSTEM "..\Cars.dtd">
<car>
    <manufacturer_bg>Ауди</manufacturer_bg>
    <manufacturer_en>Audi</manufacturer_en>
    <model generation = "Д4">С8</model>        
    <year_of_production>2012</year_of_production>
    <body_type>Седан</body_type>
    <powertrain>
        <engine fuel = "бензин" number_of_cylinders = "8" position="отпред">
            <power units = "конски сили">520</power>
            <torque units = "нютон метри" at="1700-5500об/мин">650</torque>
            <capacity units = "см3">3993</capacity>
            <consumption units = "литри/100 км." type = "комбиниран">10.1</consumption>
            <emissions units = "грама CO2/км." class = "ЕВРО5">235</emissions>
        </engine>
        <transmission number_of_gears = "8">автоматична</transmission>
    </powertrain>
    <acceleration units = "секунди" type = "0-100км/ч">4.2</acceleration>
    <maximum_speed units = "км/ч">250</maximum_speed>
    <fuel_tank_volume units = "литри">90</fuel_tank_volume>
    <chassi>
        <front_suspension>многолостово окачване</front_suspension>
        <rear_suspension>независимо окачване на трапецовидни носачи</rear_suspension>
        <front_brakes>дискови вентилирани</front_brakes>
        <rear_brakes>дискови вентилирани</rear_brakes>
    </chassi>        
    <number_of_doors>4</number_of_doors>
    <number_of_seats>5</number_of_seats>
    <kerb_weight units = "кг.">1975</kerb_weight>
    <length units = "мм">5146</length>
    <width units = "мм">1949</width>
    <height units = "мм">1458</height>
    <features>
        <feature>Антиблокираща система</feature>
        <feature>Тракшън контрол</feature>
        <feature>4x4</feature>
        <feature>Климатроник</feature>
        <feature>Круиз контрол</feature>
        <feature>Система - асистент при паркиране</feature>
        <feature>Сензор за дъжд</feature>
        <feature>Вградена система за навигация</feature>
        <feature>Отопление на седалките</feature>
        <feature>Спортно окачване</feature>
        <feature>Спортни седалки</feature>
        <feature>Сензор за светлина</feature>
        <feature>Старт-стоп система</feature>
        <feature>Електронен контрол на стабилността</feature>
    </features>        
</car>
