<?xml version="1.0" encoding="UTF-8"?>
<!DOCTYPE car SYSTEM "..\Cars.dtd">
<car>
    <manufacturer_bg>Нисан</manufacturer_bg>
    <manufacturer_en>Nissan</manufacturer_en>
    <model generation = "ГТР фейслифт">ГТР</model>        
    <year_of_production>2011</year_of_production>
    <body_type>Купе</body_type>
    <powertrain>
        <engine fuel = "бензин" number_of_cylinders = "6" position="отзад">
            <power units = "конски сили">530</power>
            <torque units = "нютон метри" at="3200-6000об/мин">612</torque>
            <capacity units = "см3">3799</capacity>
            <consumption units = "литри/100 км." type = "комбиниран">12</consumption>
            <emissions units = "грама CO2/км." class = "ЕВРО5">279</emissions>
        </engine>
        <transmission number_of_gears = "6">автоматична</transmission>
    </powertrain>
    <acceleration units = "секунди" type = "0-100км/ч">3.1</acceleration>
    <maximum_speed units = "км/ч">315</maximum_speed>
    <fuel_tank_volume units = "литри">74</fuel_tank_volume>
    <chassi>
        <front_suspension>двоен напречен носач</front_suspension>
        <rear_suspension>многолостово независимо окачване</rear_suspension>
        <front_brakes>дискови вентилирани</front_brakes>
        <rear_brakes>дискови</rear_brakes>
    </chassi>        
    <number_of_doors>2</number_of_doors>
    <number_of_seats>4</number_of_seats>
    <kerb_weight units = "кг.">1740</kerb_weight>
    <length units = "мм">4670</length>
    <width units = "мм">1895</width>
    <height units = "мм">1370</height>
    <features>
        <feature>Антиблокираща система</feature>
        <feature>Тракшън контрол</feature>        
        <feature>Климатроник</feature>
        <feature>Темпомат</feature>
        <feature>Фарове за мъгла</feature>
        <feature>Спортно окачване</feature>
        <feature>Навигация</feature>
        <feature>Отопление на седалките</feature>
        <feature>Устройство "свободни ръце"</feature> 
    </features>        
</car>

