<?xml version="1.0" encoding="UTF-8"?>
<!DOCTYPE car SYSTEM "..\Cars.dtd">
<car>
    <manufacturer_bg>Алфа Ромео</manufacturer_bg>
    <manufacturer_en>Alfa Romeo</manufacturer_en>
    <model generation = "952">Giulia</model>        
    <year_of_production>2016</year_of_production>
    <body_type>Седан</body_type>
    <powertrain>
        <engine fuel = "бензин" number_of_cylinders = "6" position="отпред">
            <power units = "конски сили">510</power>
            <torque units = "нютон метри" at="2500об/мин">600</torque>
            <capacity units = "см3">2891</capacity>
            <consumption units = "литри/100 км." type = "комбиниран">8.5</consumption>
            <emissions units = "грама CO2/км." class = "ЕВРО6">198</emissions>
        </engine>
        <transmission number_of_gears = "6">ръчна</transmission>
    </powertrain>
    <acceleration units = "секунди" type = "0-100км/ч">3.9</acceleration>
    <maximum_speed units = "км/ч">307</maximum_speed>
    <fuel_tank_volume units = "литри">58</fuel_tank_volume>
    <chassi>
        <front_suspension>двоен напречен носач</front_suspension>
        <rear_suspension>многолостово независимо окачване</rear_suspension>
        <front_brakes>дискови вентилирани</front_brakes>
        <rear_brakes>дискови вентилирани</rear_brakes>
    </chassi>   
    <number_of_doors>4</number_of_doors>
    <number_of_seats>5</number_of_seats>
    <kerb_weight units = "кг.">1580</kerb_weight>
    <length units = "мм">4639</length>
    <width units = "мм">1873</width>
    <height units = "мм">1426</height>
    <features>
        <feature>Антиблокираща система</feature>
        <feature>Тракшън контрол</feature>
        <feature>Круиз контрол</feature>
        <feature>Куатро</feature>
        <feature>Двузонов климатроник</feature>
        <feature>Сензор за дъжд</feature>
        <feature>Спортни седалки</feature>
        <feature>Система - асистент при паркиране</feature>            
    </features>        
</car>
