<?xml version="1.0" encoding="UTF-8"?>
<!DOCTYPE car SYSTEM "..\Cars.dtd">
<car>
    <manufacturer_bg>Пежо</manufacturer_bg>
    <manufacturer_en>Peugeot</manufacturer_en>
    <model generation = "РС" >206</model>        
    <year_of_production>2002</year_of_production>
    <body_type>Хечбек</body_type>
    <powertrain>
        <engine fuel = "бензин" number_of_cylinders = "4" position="отпред">
            <power units = "конски сили">177</power>
            <torque units = "нютон метри" at = "4750об/мин">202</torque>
            <capacity units = "см3">1997</capacity>
            <consumption units = "литри/100 км." type = "комбиниран">8.6</consumption>
            <emissions units = "грама CO2/км." class = "ЕВРО4">204</emissions>
        </engine>
        <transmission number_of_gears = "5">ръчна</transmission>
    </powertrain>
    <acceleration units = "секунди" type = "0-100км/ч">7.5</acceleration>
    <maximum_speed units = "км/ч">220</maximum_speed>
    <fuel_tank_volume units = "литри">50</fuel_tank_volume>
    <chassi>
        <front_suspension>амортисьорна стойка</front_suspension>
        <rear_suspension>торсион</rear_suspension>
        <front_brakes>дискови вентилирани</front_brakes>
        <rear_brakes>дискови</rear_brakes>
    </chassi>        
    <number_of_doors>3</number_of_doors>
    <number_of_seats>5</number_of_seats>
    <kerb_weight units = "кг.">1100</kerb_weight>
    <length units = "мм">3835</length>
    <width units = "мм">1673</width>
    <height units = "мм">1430</height>
    <features>
        <feature>Антиблокираща система</feature>                        
        <feature>Климатроник</feature>   
        <feature>Ел. стъкла</feature>
        <feature>Тракшън-контрол</feature>
        <feature>Фарове за мъгла</feature>
        <feature>Имобилайзер</feature>        
    </features>        
</car>  

