<?xml version="1.0" encoding="UTF-8"?>
<!DOCTYPE car SYSTEM "..\Cars.dtd">
<car>
    <manufacturer_bg>Мазда</manufacturer_bg>
    <manufacturer_en>Mazda</manufacturer_en>
    <model generation = "РХ-8">РХ-8</model>        
    <year_of_production>2003</year_of_production>
    <body_type>Купе</body_type>
    <powertrain>
        <engine fuel = "бензин" number_of_cylinders = "4" position = "отпред">
            <power units = "конски сили">250</power>
            <torque units = "нютон метри" at = "7500об/мин">216</torque>
            <capacity units = "см3">1308</capacity>
            <consumption units = "литри/100 км." type = "комбиниран">11.4</consumption>
            <emissions units = "грама CO2/км." class = "ЕВРО3">284</emissions>
        </engine>
        <transmission number_of_gears = "6">ръчна</transmission>
    </powertrain>
    <acceleration units = "секунди" type = "0-100км/ч">6.5</acceleration>
    <maximum_speed units = "км/ч">250</maximum_speed>
    <fuel_tank_volume units = "литри">61</fuel_tank_volume>
    <chassi>
        <front_suspension>амортисьорна стойка</front_suspension>
        <rear_suspension>винтова пружина</rear_suspension>
        <front_brakes>дискови вентилирани</front_brakes>
        <rear_brakes>дискови</rear_brakes>
    </chassi>        
    <number_of_doors>4</number_of_doors>
    <number_of_seats>4</number_of_seats>
    <kerb_weight units = "кг.">1345</kerb_weight>
    <length units = "мм">4325</length>
    <width units = "мм">1780</width>
    <height units = "мм">1330</height>
    <features>
        <feature>Антиблокираща система</feature>
        <feature>Мултифункционален волан</feature>
        <feature>Подгряване на волана</feature>
        <feature>Спортно окачване</feature>
        <feature>Климатроник</feature>
        <feature>Вградена система за навигация</feature>
        <feature>Отопление на седалките</feature>
        <feature>Тракшън-контрол</feature>            
    </features>        
</car>


