<?xml version="1.0" encoding="UTF-8"?>
<!DOCTYPE car SYSTEM "..\Cars.dtd">
<car>
    <manufacturer_bg>Ферари</manufacturer_bg>
    <manufacturer_en>Ferrari</manufacturer_en>
    <model generation = "Енцо" >Енцо</model>        
    <year_of_production>2002</year_of_production>
    <body_type>Купе</body_type>
    <powertrain>
        <engine fuel = "бензин" number_of_cylinders = "12" position="отзад">
            <power units = "конски сили">660</power>
            <torque units = "нютон метри" at = "5500об/мин">657</torque>
            <capacity units = "см3">5998</capacity>
            <consumption units = "литри/100 км." type = "комбиниран">23</consumption>
            <emissions units = "грама CO2/км." class = "ЕВРО4">545</emissions>
        </engine>
        <transmission number_of_gears = "6">ръчна</transmission>
    </powertrain>
    <acceleration units = "секунди" type = "0-100км/ч">3.65</acceleration>
    <maximum_speed units = "км/ч">350</maximum_speed>
    <fuel_tank_volume units = "литри">110</fuel_tank_volume>
    <chassi>
        <front_suspension>двоен напречен носач</front_suspension>
        <rear_suspension>двоен напречен носач</rear_suspension>
        <front_brakes>дискови вентилирани</front_brakes>
        <rear_brakes>дискови вентилирани</rear_brakes>
    </chassi>        
    <number_of_doors>2</number_of_doors>
    <number_of_seats>2</number_of_seats>
    <kerb_weight units = "кг.">1365</kerb_weight>
    <length units = "мм">4702</length>
    <width units = "мм">2035</width>
    <height units = "мм">1147</height>
    <features>
        <feature>Антиблокираща система</feature>                        
        <feature>Серво управление</feature>                        
        <feature>Имобилайзер</feature>           
        <feature>Мултифункционален волан</feature>
        <feature>Електрически странични огледала</feature>
        <feature>Електронна система за стабилизация</feature>        
    </features>        
</car>   
