<?xml version="1.0" encoding="UTF-8"?>
<!DOCTYPE car SYSTEM "..\Cars.dtd">
<car>
    <manufacturer_bg>Ферари</manufacturer_bg>
    <manufacturer_en>Ferrari</manufacturer_en>
    <model generation = "Италия">458</model>        
    <year_of_production>2009</year_of_production>
    <body_type>Купе</body_type>
    <powertrain>
        <engine fuel = "бензин" number_of_cylinders = "8" position="отзад">
            <power units = "конски сили">570</power>
            <torque units = "нютон метри" at="6000об/мин">540</torque>
            <capacity units = "см3">4497</capacity>
            <consumption units = "литри/100 км." type = "комбиниран">13.3</consumption>
            <emissions units = "грама CO2/км." class = "ЕВРО5">307</emissions>
        </engine>
        <transmission number_of_gears = "7">автоматична</transmission>
    </powertrain>
    <acceleration units = "секунди" type = "0-100км/ч">3.4</acceleration>
    <maximum_speed units = "км/ч">325</maximum_speed>
    <fuel_tank_volume units = "литри">86</fuel_tank_volume>
    <chassi>
        <front_suspension>многолостово независимо окачване</front_suspension>
        <rear_suspension>многолостово независимо окачване</rear_suspension>
        <front_brakes>дискови вентилирани</front_brakes>
        <rear_brakes>дискови вентилирани</rear_brakes>
    </chassi>        
    <number_of_doors>2</number_of_doors>
    <number_of_seats>2</number_of_seats>
    <kerb_weight units = "кг.">1380</kerb_weight>
    <length units = "мм">4527</length>
    <width units = "мм">1937</width>
    <height units = "мм">1213</height>
    <features>
        <feature>Антиблокираща система</feature>
        <feature>Тракшън контрол</feature>
        <feature>Алармена система</feature>
        <feature>Климатроник</feature>
        <feature>Блутут</feature>            
    </features>        
</car>

