<?xml version="1.0" encoding="UTF-8"?>
<!DOCTYPE car SYSTEM "..\Cars.dtd">
<car>
    <manufacturer_bg>Лексус</manufacturer_bg>
    <manufacturer_en>Lexus</manufacturer_en>
    <model generation = "ЛФА" >ЛФА</model>        
    <year_of_production>2010</year_of_production>
    <body_type>Купе</body_type>
    <powertrain>
        <engine fuel = "бензин" number_of_cylinders = "10" position="отпред">
            <power units = "конски сили">560</power>
            <torque units = "нютон метри" at="6800об/мин">480</torque>
            <capacity units = "см3">4805</capacity>
            <consumption units = "литри/100 км." type = "комбиниран">19.6</consumption>
            <emissions units = "грама CO2/км." class = "ЕВРО5">379</emissions>
        </engine>
        <transmission number_of_gears = "6">автоматична</transmission>
    </powertrain>
    <acceleration units = "секунди" type = "0-100км/ч">3.7</acceleration>
    <maximum_speed units = "км/ч">326</maximum_speed>
    <fuel_tank_volume units = "литри">73</fuel_tank_volume>
    <chassi>
        <front_suspension>двоен напречен носач</front_suspension>
        <rear_suspension>многолостово независимо окачване</rear_suspension>
        <front_brakes>дискови вентилирани</front_brakes>
        <rear_brakes>дискови вентилирани</rear_brakes>
    </chassi>        
    <number_of_doors>2</number_of_doors>
    <number_of_seats>2</number_of_seats>
    <kerb_weight units = "кг.">1480</kerb_weight>
    <length units = "мм">4505</length>
    <width units = "мм">1895</width>
    <height units = "мм">1220</height>
    <features>
        <feature>Антиблокираща система</feature>                        
        <feature>Климатроник</feature>         
        <feature>Тракшън-контрол</feature>
        <feature>Отопление на седалките</feature>
        <feature>Ел. седалки</feature>
        <feature>Парктроник</feature>
        <feature>Сензор за дъжд</feature>
        <feature>Навигация</feature>
        <feature>Темпомат</feature>
    </features>        
</car>

