<?xml version="1.0" encoding="UTF-8"?>
<!DOCTYPE car SYSTEM "..\Cars.dtd">
<car>
    <manufacturer_bg>Фолксваген</manufacturer_bg>
    <manufacturer_en>Volkswagen</manufacturer_en>
    <model generation = "ССI" >Пасат</model>        
    <year_of_production>2012</year_of_production>
    <body_type>Купе</body_type>
    <powertrain>
        <engine fuel = "бензин" number_of_cylinders = "6" position="отпред">
            <power units = "конски сили">300</power>
            <torque units = "нютон метри" at = "2400-5300об/мин">350</torque>
            <capacity units = "см3">3597</capacity>
            <consumption units = "литри/100 км." type = "комбиниран">9.2</consumption>
            <emissions units = "грама CO2/км." class = "ЕВРО5">215</emissions>
        </engine>
        <transmission number_of_gears = "6">автоматична</transmission>
    </powertrain>
    <acceleration units = "секунди" type = "0-100км/ч">5.5</acceleration>
    <maximum_speed units = "км/ч">250</maximum_speed>
    <fuel_tank_volume units = "литри">70</fuel_tank_volume>
    <chassi>
        <front_suspension>независимо пружинно тип McPherson със стабилизатор</front_suspension>
        <rear_suspension>винтова пружина</rear_suspension>
        <front_brakes>дискови вентилирани</front_brakes>
        <rear_brakes>дискови</rear_brakes>
    </chassi>        
    <number_of_doors>4</number_of_doors>
    <number_of_seats>5</number_of_seats>
    <kerb_weight units = "кг.">1704</kerb_weight>
    <length units = "мм">4802</length>
    <width units = "мм">1855</width>
    <height units = "мм">1417</height>
    <features>
        <feature>Антиблокираща система</feature>                        
        <feature>Климатроник</feature>                        
        <feature>4x4</feature>           
        <feature>Сензор за дъжд</feature>
        <feature>Ел. стъкла</feature>
        <feature>Спортни седалки</feature>
        <feature>Спортно окачване</feature>
        <feature>Отопление на седалките</feature>
        <feature>Система - асистент при паркиране</feature>
        <feature>Вградена система за навигация</feature>
        <feature>Сензор за светлина</feature>
        <feature>Старт-стоп система</feature>
    </features>        
</car>   
